Lead ID,jobtitle,LS Title,LS Company,LS Lead Job Functions,LS Company Industry,LS Lead Department
486,一般社員,Account Development Dept / General Producer,ADK,Account Development; Software Development; Account Management; Event Management; Advertising,Business Services,Sales
487,担当部長,Senior Vice President,"hitachi, ltd.",President,Computers & Electronics,Management
488,助教授,Assistant Professor,Japan Aerospace Exploration Agency,Education,Manufacturing,
489,課長,Project Manager,DENSO,Project Management,Manufacturing,Product Management
1,Senior manager,Senior Cyber Security analyst,Sony Group Corporation,Security Analysis; Cyber Security; Information Security; Security Management; Network Security; Incident Management,Telecommunications,Information Technology
2,"Owner, Marketing/Sales",Supervisor & Trade Lane Manager of EMEA,Hankyu Hanshin Express,,Transportation & Storage,
3,"Manager, Information Technology",Leader,MISUMI Group Inc.,Systems Management; Retail; Requirements Management; Art; Software Development; Technology & Innovation; Information Technology and Services; Logistics,Manufacturing,Management
4,"Individual Contributor/Staff, Marketing/Sales",Sales Specialist,JTB,Media Marketing; Social Media; Digital Marketing; Social Media Marketing,"Travel, Recreation, and Leisure",Sales
5,"Manager, Accounting and Finance","Manager, Finance Transformation","amkor technology, inc.",Business Strategy; Loans; Financial Reporting; Customer Service; Strategy Development; Accounting; Budget Management; IT Process Management; Process Improvement; Investment Management; Corporate Development; Software Development; Investments; Digital Technology; Outreach; Financial Management; Change Management; Business Process Management; Financial Analysis; Financial Services; Banking; Revenue Management; Capital Management; Training and Development; Reporting; Program Management; Project Management; Data Analysis; Business Continuity,Energy & Utilities,Finance
